dataset_id,source_name,url_or_drive_note,label_type,local_path_on_disk,file_format,n_subjects_or_rows,notes,license,curator_initials,date_added,split_policy
PADS_LOCAL,PADS smartwatch (this repo),N/A,L-sample+condition,data/raw/pads-parkinsons-disease-smartwatch-dataset-1.0.0/,various,TBD,"preprocessed bins in preprocessed/movement/ when you've run it — fill N when someone counts",TBD,,,patient_level
PARKINSON_AT_HOME,Parkinson@Home,https://drive.google.com/drive/folders/1XlzJAWlcK7XAoa4dr-TLPmwOjOw35bR4,L-sample tremor/activity sync with sensors,data/raw/parkinson_at_home/README only unless copied,"mat + csv on drive; .csv data / .csv labels folders; patient_info.csv",TBD,"Official README dirs + Drive extras: .csv labels .csv data formatted data; key mats phys_cur_PD_merged phys_cur_HC_merged labels_PD_phys_tremorfog_sharing labels_HC_phys_sharing; sync peakstart/end with label times; see DATA_SOURCES",see LICENSE.txt on Drive,,,patient_level
KAGGLE_MPU9250,Kaggle Hand Tremor MPU9250,https://www.kaggle.com/datasets/aaryapandya/hand-tremor-dataset-collected-using-mpu9250-sensor,L-sample binary Result,data/external/kaggle_mpu9250/Dataset.csv,Dataset.csv,~27995 rows,"Per Kaggle About: 3 MPU9250 sensors on hand; Result 1=shaking hand 0=stable; acc+gyro used mag cols all -1 (~unused); ~12749 stable ~15246 shaking",Unknown (Kaggle page),,,row_level
ZENODO_ALAMEDA,ALAMEDA PD tremor Zenodo,https://zenodo.org/records/10782573,L-sample window features,TBD_DOWNLOAD/,ALAMEDA_PD_tremor_dataset.csv,TBD,"92 feat cols not raw imu — not vetted fully yet",zenodo,,,TBD
IEEE_BIOSTAMP,PD-BioStampRC21,https://ieee-dataport.org/open-access/pd-biostamprc21-parkinsons-disease-accelerometry-dataset-five-wearable-sensor-study-0,L-subject PD vs HC,TBD_DOWNLOAD/,TBD,TBD,"pd vs hc per person not per window — dont misuse",ieee tos,,,subject_level
GITHUB_TREMOR_COMPILATION,jiehu01 PD tremor GitHub,https://github.com/jiehu01/Parkinson-s-Disease-Tremor-Dataset,mixed 0-3 severity,TBD clone/,TBD,TBD,"each subfolder might differ — read before merging",varies,,,TBD
NEW_MEXICO,New Mexico unlabeled pool,TBD from team,Unlabeled or L-subject,TBD,,TBD,"need team to confirm path",TBD,,,TBD
